{
  "pcb_length": 85.0,
  "pcb_width": 56.0,
  "pcb_thickness": 1.6,
  "pcb_corner_radius": 3.0,
  "mount_pitch_x": 58.0,
  "mount_pitch_y": 49.0,
  "mount_edge_offset": 3.5,
  "mount_hole_diameter": 2.7,
  "pcb_clearance": 1.2,
  "wall_thickness": 2.4,
  "floor_thickness": 2.4,
  "base_height": 24.0,
  "outer_corner_radius": 4.0,
  "standoff_diameter": 6.4,
  "standoff_height": 4.0,
  "screw_clearance_diameter": 2.9,
  "lid_top_thickness": 2.4,
  "lid_skirt_depth": 3.2,
  "lid_skirt_thickness": 1.8,
  "lid_fit_clearance": 0.15,
  "usb_c_center_x": -32.5,
  "usb_c_opening_width": 13.0,
  "micro_hdmi_0_center_x": -13.4,
  "micro_hdmi_1_center_x": 0.1,
  "micro_hdmi_opening_width": 10.0,
  "audio_center_x": 19.5,
  "audio_opening_width": 10.0,
  "usb_2_center_y": -18.0,
  "usb_3_center_y": 0.0,
  "usb_opening_width": 16.5,
  "ethernet_center_y": 18.0,
  "ethernet_opening_width": 17.0,
  "microsd_center_y": -15.5,
  "microsd_opening_width": 17.0,
  "gpio_slot_center_x": -10.5,
  "gpio_slot_center_y": 23.7,
  "gpio_slot_length": 54.0,
  "gpio_slot_width": 8.5,
  "fan_center_x": -5.0,
  "fan_center_y": 0.0,
  "fan_hole_pitch": 24.0,
  "fan_screw_diameter": 3.2
}
